{
  "provenance_schema_version": 4,
  "cast_target": "claude",
  "mold": {
    "name": "freeform-summary-to-galaxy-interface",
    "path": "content/molds/freeform-summary-to-galaxy-interface/index.md",
    "revision": 3,
    "content_hash": "de0cb02532205ad18f4aa1ab2881cac725a3191b448468a8a11d0663ff1ec97d",
    "commit": "351623a6d3e96e9bdee421a3ef61df4306489e32"
  },
  "cast_at": "2026-09-08T18:03:22.527Z",
  "refs": [
    {
      "kind": "research",
      "mode": "verbatim",
      "ref": "[[galaxy-collection-semantics]]",
      "src": "content/research/galaxy-collection-semantics/index.md",
      "dst": "references/notes/galaxy-collection-semantics.md",
      "used_at": "runtime",
      "load": "on-demand",
      "evidence": "corpus-observed",
      "purpose": "Choose Galaxy collection input shapes (File / list / paired / list:paired / record) from the source's per-sample, paired, grouped, or nested data descriptions.",
      "trigger": "When the free-form summary describes paired reads, per-sample groups, nested or grouped inputs, or any input that should become a Galaxy dataset collection.",
      "license": "MIT",
      "license_file": "LICENSES/galaxy.LICENSE",
      "src_hash": "4ddc7587e187cf38a3dca02d6966e2f6ea58f9faf9bd97034ad513eb4c4c638b",
      "dst_hash": "4ddc7587e187cf38a3dca02d6966e2f6ea58f9faf9bd97034ad513eb4c4c638b",
      "source": "deterministic",
      "license_file_hash": "3fdd32b75cfad3266871456423f4d91529953629fe4bc803c3df2f445fd8a858"
    },
    {
      "kind": "research",
      "mode": "verbatim",
      "ref": "[[galaxy-collection-semantics]]",
      "src": "content/research/galaxy-collection-semantics/galaxy-collection-semantics.yml",
      "dst": "references/notes/galaxy-collection-semantics.yml",
      "used_at": "runtime",
      "load": "on-demand",
      "evidence": "corpus-observed",
      "purpose": "Choose Galaxy collection input shapes (File / list / paired / list:paired / record) from the source's per-sample, paired, grouped, or nested data descriptions.",
      "trigger": "When the free-form summary describes paired reads, per-sample groups, nested or grouped inputs, or any input that should become a Galaxy dataset collection.",
      "companion_of": "references/notes/galaxy-collection-semantics.md",
      "license": "MIT",
      "license_file": "LICENSES/galaxy.LICENSE",
      "src_hash": "f4e9d0a55459b6080b826e2ae41a920c9404f95fda0e518be8f86bc3d2e73e6e",
      "dst_hash": "f4e9d0a55459b6080b826e2ae41a920c9404f95fda0e518be8f86bc3d2e73e6e",
      "source": "deterministic",
      "license_file_hash": "3fdd32b75cfad3266871456423f4d91529953629fe4bc803c3df2f445fd8a858"
    },
    {
      "kind": "research",
      "mode": "verbatim",
      "ref": "[[galaxy-sample-sheet-collections]]",
      "src": "content/research/galaxy-sample-sheet-collections/index.md",
      "dst": "references/notes/galaxy-sample-sheet-collections.md",
      "used_at": "runtime",
      "load": "on-demand",
      "evidence": "corpus-observed",
      "purpose": "Pick the right sample_sheet variant and translate described per-sample column metadata into Galaxy column_definitions when the source describes sample-sheet-shaped inputs.",
      "trigger": "When the free-form summary describes a sample sheet, a per-sample/per-record table, or any table mapping samples to files that should become a Galaxy collection or sample-sheet input.",
      "src_hash": "98736fdcd0c4f4698af4e0cd4c539b33e3d0db872de1e10487556b21033030ec",
      "dst_hash": "98736fdcd0c4f4698af4e0cd4c539b33e3d0db872de1e10487556b21033030ec",
      "source": "deterministic"
    },
    {
      "kind": "research",
      "mode": "verbatim",
      "ref": "[[galaxy-workflow-testability-design]]",
      "src": "content/research/galaxy-workflow-testability-design/index.md",
      "dst": "references/notes/galaxy-workflow-testability-design.md",
      "used_at": "runtime",
      "load": "on-demand",
      "evidence": "corpus-observed",
      "purpose": "Choose stable workflow input/output labels and promoted checkpoint outputs that future tests can address.",
      "trigger": "When deciding labels, public outputs, checkpoint outputs, or fixture-compatible collection inputs.",
      "src_hash": "81b01801ec3d14810d570dd2d7815da2bb11e41a562af9182c29fd2974f4b855",
      "dst_hash": "81b01801ec3d14810d570dd2d7815da2bb11e41a562af9182c29fd2974f4b855",
      "source": "deterministic"
    },
    {
      "kind": "research",
      "mode": "verbatim",
      "ref": "[[open-requirements-ledger]]",
      "src": "content/research/open-requirements-ledger/index.md",
      "dst": "references/notes/open-requirements-ledger.md",
      "used_at": "runtime",
      "load": "upfront",
      "evidence": "hypothesis",
      "purpose": "Inherit open entries rather than re-deriving them, close the ones this brief's input, output, and label decisions settle, and append interface obligations the narrative never settles — an output the source names but never specifies, a parameter stated only qualitatively, a collection shape the prose doesn't determine.",
      "verification": "Promote after a worked run shows entries this Mold appends or resolves are consumed downstream without re-derivation.",
      "src_hash": "e1d5e3a4d6d650af5b2efc4703fe6f79bb4d0cc12e6cd14e841c5b91df122ea0",
      "dst_hash": "e1d5e3a4d6d650af5b2efc4703fe6f79bb4d0cc12e6cd14e841c5b91df122ea0",
      "source": "deterministic"
    }
  ],
  "artifacts": {
    "produces": [
      {
        "id": "freeform-galaxy-interface",
        "kind": "markdown",
        "default_filename": "freeform-galaxy-interface.md",
        "description": "Reviewable Markdown brief: Galaxy workflow inputs, outputs, labels, collection shapes, checkpoint outputs, source-summary provenance, confidence, open questions."
      },
      {
        "id": "open-requirements-ledger",
        "kind": "yaml",
        "default_filename": "open-requirements.ledger.yml",
        "description": "Carried obligations ledger re-emitted by this step: entries it appended or closed updated, every other entry passed through with its provenance intact."
      }
    ],
    "consumes": [
      {
        "id": "freeform-summary",
        "description": "Free-form source summary emitted by [[summarize-paper]] or [[interview-to-freeform-summary]]; methods, tools, sample data, references, and workflow intent with explicit uncertainty.",
        "producers": [
          "interview-to-freeform-summary",
          "summarize-paper"
        ]
      },
      {
        "id": "open-requirements-ledger",
        "description": "Carried obligations ledger [[open-requirements-ledger]]: the run's open, resolved, and surrendered entries with their provenance. Absent on the first Mold of a run; start an empty one.",
        "producers": [
          "advance-galaxy-draft-step",
          "apply-galaxy-workflow-changeset",
          "compare-against-iwc-exemplar",
          "cwl-summary-to-galaxy-data-flow",
          "cwl-summary-to-galaxy-interface",
          "cwl-summary-to-galaxy-template",
          "freeform-summary-to-galaxy-data-flow",
          "freeform-summary-to-galaxy-interface",
          "freeform-summary-to-galaxy-template",
          "implement-galaxy-tool-step",
          "interview-to-galaxy-workflow-changeset",
          "nextflow-summary-to-galaxy-data-flow",
          "nextflow-summary-to-galaxy-interface",
          "nextflow-summary-to-galaxy-reference-data",
          "nextflow-summary-to-galaxy-template",
          "repair-galaxy-draft-topology"
        ]
      }
    ]
  }
}
