{
  "provenance_schema_version": 4,
  "cast_target": "claude",
  "mold": {
    "name": "validate-cwl",
    "path": "content/molds/validate-cwl/index.md",
    "revision": 3,
    "content_hash": "7f867c61f5c23c56116293043e54f48273cba56992139df9e4b44c92f5643b81",
    "commit": "351623a6d3e96e9bdee421a3ef61df4306489e32"
  },
  "cast_at": "2026-09-08T18:03:27.938Z",
  "refs": [],
  "artifacts": {
    "produces": [],
    "consumes": [
      {
        "id": "cwl-workflow-draft",
        "description": "Assembled CWL Workflow to validate — the `cwl-workflow-draft.cwl` from [[implement-cwl-tool-step]] (`class: Workflow`); the build result `cwltool --validate` and schema lint run against.",
        "producers": [
          "implement-cwl-tool-step",
          "summary-to-cwl-template"
        ]
      }
    ]
  }
}
