{
  "provenance_schema_version": 4,
  "cast_target": "claude",
  "mold": {
    "name": "summarize-paper",
    "path": "content/molds/summarize-paper/index.md",
    "revision": 2,
    "content_hash": "ac601516a655a5a97bf9cc6d865839622efd509a295f99410c9e47e3952f269d",
    "commit": "351623a6d3e96e9bdee421a3ef61df4306489e32"
  },
  "cast_at": "2026-09-08T18:03:27.306Z",
  "refs": [],
  "artifacts": {
    "produces": [
      {
        "id": "freeform-summary",
        "kind": "markdown",
        "default_filename": "freeform-summary.md",
        "description": "Methods, tools, sample data, references, and workflow intent extracted from a primary paper, normalized into the shared free-form source summary handoff."
      }
    ],
    "consumes": []
  }
}
