{
  "provenance_schema_version": 4,
  "cast_target": "claude",
  "mold": {
    "name": "freeform-summary-to-cwl-design",
    "path": "content/molds/freeform-summary-to-cwl-design/index.md",
    "revision": 1,
    "content_hash": "bdc96941ec75c70907bac77ab58b94da70923cb81ab28da3badd3410ce38a678",
    "commit": "351623a6d3e96e9bdee421a3ef61df4306489e32"
  },
  "cast_at": "2026-09-08T18:03:22.073Z",
  "refs": [],
  "artifacts": {
    "produces": [
      {
        "id": "freeform-cwl-design",
        "kind": "markdown",
        "default_filename": "freeform-cwl-design.md",
        "description": "Combined CWL interface + data-flow design brief; a single reviewable handoff for free-form sources until examples justify a split."
      }
    ],
    "consumes": [
      {
        "id": "freeform-summary",
        "description": "Free-form source summary emitted by [[summarize-paper]] or [[interview-to-freeform-summary]]; methods, tools, sample data, references, and workflow intent.",
        "producers": [
          "interview-to-freeform-summary",
          "summarize-paper"
        ]
      }
    ]
  }
}
