{
  "provenance_schema_version": 4,
  "cast_target": "claude",
  "mold": {
    "name": "freeform-summary-to-galaxy-test-plan",
    "path": "content/molds/freeform-summary-to-galaxy-test-plan/index.md",
    "revision": 2,
    "content_hash": "9c1d56e625a5dd26cb7a82082ac8f4eeb7db287a626bf00e73457c8dd491ad6d",
    "commit": "351623a6d3e96e9bdee421a3ef61df4306489e32"
  },
  "cast_at": "2026-09-08T18:03:23.227Z",
  "refs": [
    {
      "kind": "research",
      "mode": "verbatim",
      "ref": "[[galaxy-workflow-testability-design]]",
      "src": "content/research/galaxy-workflow-testability-design/index.md",
      "dst": "references/notes/galaxy-workflow-testability-design.md",
      "used_at": "runtime",
      "load": "on-demand",
      "evidence": "corpus-observed",
      "purpose": "Choose which workflow outputs and promoted checkpoints make meaningful assertions when no upstream test evidence exists.",
      "trigger": "When deciding which outputs to assert, which checkpoints to promote, and which labels the plan should assume.",
      "src_hash": "81b01801ec3d14810d570dd2d7815da2bb11e41a562af9182c29fd2974f4b855",
      "dst_hash": "81b01801ec3d14810d570dd2d7815da2bb11e41a562af9182c29fd2974f4b855",
      "source": "deterministic"
    },
    {
      "kind": "research",
      "mode": "verbatim",
      "ref": "[[iwc-shortcuts-anti-patterns]]",
      "src": "content/research/iwc-shortcuts-anti-patterns/index.md",
      "dst": "references/notes/iwc-shortcuts-anti-patterns.md",
      "used_at": "runtime",
      "load": "on-demand",
      "evidence": "corpus-observed",
      "purpose": "Distinguish accepted IWC-style test shortcuts from assertion smells while synthesizing assertions from intent.",
      "trigger": "When considering existence-only, size-only, image-dimension, or tolerant output checks, or recording an omission.",
      "src_hash": "14cc27c6a3e01588b06151535afdcb671cadd8e10dc960a248934e9133ebc8ab",
      "dst_hash": "14cc27c6a3e01588b06151535afdcb671cadd8e10dc960a248934e9133ebc8ab",
      "source": "deterministic"
    },
    {
      "kind": "research",
      "mode": "verbatim",
      "ref": "[[iwc-test-data-conventions]]",
      "src": "content/research/iwc-test-data-conventions/index.md",
      "dst": "references/notes/iwc-test-data-conventions.md",
      "used_at": "runtime",
      "load": "on-demand",
      "evidence": "corpus-observed",
      "purpose": "Describe job-input fixtures, remote-URL-first locations, hashes, and collection input shapes the plan should record as fixture provenance.",
      "trigger": "When recording job inputs or fixture provenance, or deciding whether a fixture belongs in test-data, Zenodo, ENA/SRA, or CVMFS.",
      "src_hash": "1921e939703444604440e0768caca6e6b834a73dcfa964f450fa081143e008d3",
      "dst_hash": "1921e939703444604440e0768caca6e6b834a73dcfa964f450fa081143e008d3",
      "source": "deterministic"
    },
    {
      "kind": "research",
      "mode": "verbatim",
      "ref": "[[planemo-asserts-idioms]]",
      "src": "content/research/planemo-asserts-idioms/index.md",
      "dst": "references/notes/planemo-asserts-idioms.md",
      "used_at": "runtime",
      "load": "on-demand",
      "evidence": "corpus-observed",
      "purpose": "Pick the assertion family and tolerance that fit each synthesized expected output by output type.",
      "trigger": "When turning an expected output into assertion intent and a tolerance.",
      "src_hash": "81b8feeccd891642572e587a494d1e4d3a1b369a19d92947626230494fd92beb",
      "dst_hash": "81b8feeccd891642572e587a494d1e4d3a1b369a19d92947626230494fd92beb",
      "source": "deterministic"
    },
    {
      "kind": "research",
      "mode": "verbatim",
      "ref": "[[planemo-workflow-test-architecture]]",
      "src": "content/research/planemo-workflow-test-architecture/index.md",
      "dst": "references/notes/planemo-workflow-test-architecture.md",
      "used_at": "runtime",
      "load": "on-demand",
      "evidence": "corpus-observed",
      "purpose": "Keep the plan addressable by stable labels and artifacts Planemo can connect back to invocations, jobs, and outputs.",
      "trigger": "When recording the labels and checkpoints the downstream test must address.",
      "src_hash": "d6ac347c8361d6c312c64c1197426673e53aa1c5577e1c72f1c80a20ccd1cce3",
      "dst_hash": "d6ac347c8361d6c312c64c1197426673e53aa1c5577e1c72f1c80a20ccd1cce3",
      "source": "deterministic"
    },
    {
      "kind": "schema",
      "mode": "verbatim",
      "ref": "[[galaxy-workflow-test-plan]]",
      "src": "package://@galaxy-foundry/gxwf-foundry#galaxyWorkflowTestPlanSchema",
      "dst": "references/schemas/galaxy-workflow-test-plan.schema.json",
      "used_at": "runtime",
      "load": "upfront",
      "evidence": "hypothesis",
      "purpose": "Output contract: the emitted plan conforms to [[galaxy-workflow-test-plan]]. Cast bundles the JSON Schema so the skill carries its output shape; validate with `foundry validate-galaxy-workflow-test-plan`.",
      "verification": "Cast the skill, run on a representative paper/interview-derived summary, confirm the emitted YAML validates and downstream [[implement-galaxy-workflow-test]] consumes it without re-reading the source summary.",
      "license": "MIT",
      "src_hash": "325e9cf1bb5e075fa818dc68868647de95389ca8df8581ee8cf1e2be61196e37",
      "dst_hash": "325e9cf1bb5e075fa818dc68868647de95389ca8df8581ee8cf1e2be61196e37",
      "source": "deterministic"
    },
    {
      "kind": "schema",
      "mode": "verbatim",
      "ref": "[[tests-format]]",
      "src": "package://@galaxy-foundry/gxwf-foundry#testsFormatSchema",
      "dst": "references/schemas/tests-format.schema.json",
      "used_at": "runtime",
      "load": "on-demand",
      "evidence": "corpus-observed",
      "purpose": "Use the Galaxy workflow tests schema as the assertion-family vocabulary referenced by the plan's assertion intent.",
      "trigger": "When naming an assertion family or compare operator for a synthesized expected output.",
      "license": "MIT",
      "license_file": "LICENSES/galaxy-tool-util-ts.LICENSE",
      "src_hash": "ff0de5041f4c3de0ab7abe9e7555c5a7120665b077f42661461301b0fb26f372",
      "dst_hash": "ff0de5041f4c3de0ab7abe9e7555c5a7120665b077f42661461301b0fb26f372",
      "source": "deterministic",
      "license_file_hash": "383450c494c01c466bcf22df102540a39ac89da50563fd7be686ba06772f96b3"
    }
  ],
  "artifacts": {
    "produces": [
      {
        "id": "galaxy-test-plan",
        "kind": "yaml",
        "default_filename": "galaxy-test-plan.yml",
        "schema": "[[galaxy-workflow-test-plan]]",
        "description": "Reviewable Galaxy workflow test plan (see [[galaxy-workflow-test-plan]]): synthesized test cases with job inputs, expected outputs, assertion intent, fixture provenance, label assumptions, unresolved mappings, and omissions."
      }
    ],
    "consumes": [
      {
        "id": "freeform-summary",
        "description": "Free-form source summary from [[summarize-paper]] or [[interview-to-freeform-summary]]; carries methods, sample data, parameters, and expected outputs that seed test intent.",
        "producers": [
          "interview-to-freeform-summary",
          "summarize-paper"
        ]
      },
      {
        "id": "freeform-galaxy-interface",
        "description": "Galaxy interface brief from [[freeform-summary-to-galaxy-interface]] that pins workflow inputs, outputs, and labels the plan binds assertions to.",
        "producers": [
          "freeform-summary-to-galaxy-interface"
        ]
      },
      {
        "id": "freeform-galaxy-data-flow",
        "description": "Galaxy data-flow brief from [[freeform-summary-to-galaxy-data-flow]] that pins abstract operations and collection choices the plan must respect.",
        "producers": [
          "freeform-summary-to-galaxy-data-flow"
        ]
      },
      {
        "id": "iwc-comparison-notes",
        "description": "Structural diff guidance from [[compare-against-iwc-exemplar]]; steers the plan toward IWC-aligned testable checkpoints and fixture shapes.",
        "producers": [
          "compare-against-iwc-exemplar"
        ]
      },
      {
        "id": "iwc-exemplar-gxformat2",
        "description": "Cleaned gxformat2 view of the nearest IWC exemplar from [[compare-against-iwc-exemplar]]; pattern-match its labels, collection identifiers, and tested checkpoints. Absent when no nearest exemplar was found.",
        "producers": [
          "compare-against-iwc-exemplar"
        ]
      }
    ]
  }
}
