{
  "provenance_schema_version": 4,
  "cast_target": "claude",
  "mold": {
    "name": "cwl-summary-to-galaxy-interface",
    "path": "content/molds/cwl-summary-to-galaxy-interface/index.md",
    "revision": 3,
    "content_hash": "9e6b0aaea5d1662a0515cd932352e418d1539da95ed81b4e8193ce0c98d48640",
    "commit": "351623a6d3e96e9bdee421a3ef61df4306489e32"
  },
  "cast_at": "2026-09-08T18:03:19.962Z",
  "refs": [
    {
      "kind": "research",
      "mode": "verbatim",
      "ref": "[[component-cwl-workflow-anatomy]]",
      "src": "content/research/component-cwl-workflow-anatomy/index.md",
      "dst": "references/notes/component-cwl-workflow-anatomy.md",
      "used_at": "runtime",
      "load": "upfront",
      "evidence": "hypothesis",
      "purpose": "Keep source-faithful CWL facts separate from Galaxy-facing interface choices.",
      "verification": "Run against the first representative CWL summaries and confirm workflow inputs/outputs map without re-parsing the original CWL.",
      "src_hash": "e91f1c14b581c51c10dd8e2d2f673b339389150de1ce65b5bac76e38fa2f37b4",
      "dst_hash": "e91f1c14b581c51c10dd8e2d2f673b339389150de1ce65b5bac76e38fa2f37b4",
      "source": "deterministic"
    },
    {
      "kind": "research",
      "mode": "verbatim",
      "ref": "[[cwl-when-pickvalue-to-galaxy-branching]]",
      "src": "content/research/cwl-when-pickvalue-to-galaxy-branching/index.md",
      "dst": "references/notes/cwl-when-pickvalue-to-galaxy-branching.md",
      "used_at": "runtime",
      "load": "on-demand",
      "evidence": "corpus-observed",
      "purpose": "Pick among the three honest Galaxy branching translations (paired_or_unpaired input, native pick_value step, sibling workflows) before drafting the interface.",
      "trigger": "When summary-cwl has any steps[].when non-null OR any workflow output uses pickValue.",
      "src_hash": "018ed7b60c3379173d76ffa0f84fadeddd444be02c38f390b84a2147e8ec9f81",
      "dst_hash": "018ed7b60c3379173d76ffa0f84fadeddd444be02c38f390b84a2147e8ec9f81",
      "source": "deterministic"
    },
    {
      "kind": "research",
      "mode": "verbatim",
      "ref": "[[galaxy-collection-semantics]]",
      "src": "content/research/galaxy-collection-semantics/index.md",
      "dst": "references/notes/galaxy-collection-semantics.md",
      "used_at": "runtime",
      "load": "on-demand",
      "evidence": "corpus-observed",
      "purpose": "Choose Galaxy collection input shapes from CWL arrays, scatter inputs, records, Directory values, and secondary-file contracts.",
      "trigger": "When CWL types include arrays, records, Directory, secondaryFiles, or scatter over File-like inputs.",
      "license": "MIT",
      "license_file": "LICENSES/galaxy.LICENSE",
      "src_hash": "4ddc7587e187cf38a3dca02d6966e2f6ea58f9faf9bd97034ad513eb4c4c638b",
      "dst_hash": "4ddc7587e187cf38a3dca02d6966e2f6ea58f9faf9bd97034ad513eb4c4c638b",
      "source": "deterministic",
      "license_file_hash": "3fdd32b75cfad3266871456423f4d91529953629fe4bc803c3df2f445fd8a858"
    },
    {
      "kind": "research",
      "mode": "verbatim",
      "ref": "[[galaxy-collection-semantics]]",
      "src": "content/research/galaxy-collection-semantics/galaxy-collection-semantics.yml",
      "dst": "references/notes/galaxy-collection-semantics.yml",
      "used_at": "runtime",
      "load": "on-demand",
      "evidence": "corpus-observed",
      "purpose": "Choose Galaxy collection input shapes from CWL arrays, scatter inputs, records, Directory values, and secondary-file contracts.",
      "trigger": "When CWL types include arrays, records, Directory, secondaryFiles, or scatter over File-like inputs.",
      "companion_of": "references/notes/galaxy-collection-semantics.md",
      "license": "MIT",
      "license_file": "LICENSES/galaxy.LICENSE",
      "src_hash": "f4e9d0a55459b6080b826e2ae41a920c9404f95fda0e518be8f86bc3d2e73e6e",
      "dst_hash": "f4e9d0a55459b6080b826e2ae41a920c9404f95fda0e518be8f86bc3d2e73e6e",
      "source": "deterministic",
      "license_file_hash": "3fdd32b75cfad3266871456423f4d91529953629fe4bc803c3df2f445fd8a858"
    },
    {
      "kind": "research",
      "mode": "verbatim",
      "ref": "[[galaxy-paired-or-unpaired-collections]]",
      "src": "content/research/galaxy-paired-or-unpaired-collections/index.md",
      "dst": "references/notes/galaxy-paired-or-unpaired-collections.md",
      "used_at": "runtime",
      "load": "on-demand",
      "evidence": "corpus-observed",
      "purpose": "Choose `paired_or_unpaired` (or `list:paired_or_unpaired`) shape when the CWL discriminator is paired-vs-single reads, instead of inventing a workflow-level `reads_mode` select parameter.",
      "trigger": "When summary-cwl declares 2+ optional File? read-like inputs whose step bindings are gated by complementary `when:` predicates, OR workflow outputs use pickValue over branches keyed on input presence, OR an upstream `meta.single_end`-style discriminator surfaces in the summary.",
      "src_hash": "f4f25820425ec5fbe4efa50b3e350981e055e959fc362510ae60837773f3d83a",
      "dst_hash": "f4f25820425ec5fbe4efa50b3e350981e055e959fc362510ae60837773f3d83a",
      "source": "deterministic"
    },
    {
      "kind": "research",
      "mode": "verbatim",
      "ref": "[[galaxy-workflow-testability-design]]",
      "src": "content/research/galaxy-workflow-testability-design/index.md",
      "dst": "references/notes/galaxy-workflow-testability-design.md",
      "used_at": "runtime",
      "load": "on-demand",
      "evidence": "corpus-observed",
      "purpose": "Choose stable Galaxy workflow input/output labels and promoted checkpoint outputs.",
      "trigger": "When deciding labels, public outputs, checkpoint outputs, or fixture-compatible collection inputs.",
      "src_hash": "81b01801ec3d14810d570dd2d7815da2bb11e41a562af9182c29fd2974f4b855",
      "dst_hash": "81b01801ec3d14810d570dd2d7815da2bb11e41a562af9182c29fd2974f4b855",
      "source": "deterministic"
    },
    {
      "kind": "research",
      "mode": "verbatim",
      "ref": "[[open-requirements-ledger]]",
      "src": "content/research/open-requirements-ledger/index.md",
      "dst": "references/notes/open-requirements-ledger.md",
      "used_at": "runtime",
      "load": "upfront",
      "evidence": "hypothesis",
      "purpose": "Inherit open entries rather than re-deriving them, close the ones this brief's input, output, and label decisions settle, and append interface obligations the CWL summary leaves open — an unmapped secondaryFiles bundle, an unpinned parameter default, a collection shape the source types don't determine.",
      "verification": "Promote after a worked run shows entries this Mold appends or resolves are consumed downstream without re-derivation.",
      "src_hash": "e1d5e3a4d6d650af5b2efc4703fe6f79bb4d0cc12e6cd14e841c5b91df122ea0",
      "dst_hash": "e1d5e3a4d6d650af5b2efc4703fe6f79bb4d0cc12e6cd14e841c5b91df122ea0",
      "source": "deterministic"
    },
    {
      "kind": "schema",
      "mode": "verbatim",
      "ref": "[[summary-cwl]]",
      "src": "package://@galaxy-foundry/gxwf-foundry#summaryCwlSchema",
      "dst": "references/schemas/summary-cwl.schema.json",
      "used_at": "runtime",
      "load": "upfront",
      "evidence": "cast-validated",
      "purpose": "Read CWL workflow inputs, outputs, types, formats, secondary files, scatter, and requirement evidence before choosing the Galaxy interface.",
      "license": "MIT",
      "src_hash": "6ba695858bcc32ef1bb1b0c9f61d8a3c1074848819b6077c50bec3c7b5f6c6ef",
      "dst_hash": "6ba695858bcc32ef1bb1b0c9f61d8a3c1074848819b6077c50bec3c7b5f6c6ef",
      "source": "deterministic"
    }
  ],
  "artifacts": {
    "produces": [
      {
        "id": "cwl-galaxy-interface",
        "kind": "markdown",
        "default_filename": "cwl-galaxy-interface.md",
        "description": "Reviewable Markdown brief: Galaxy workflow inputs, outputs, labels, exposed and checkpoint outputs, source provenance, confidence."
      },
      {
        "id": "open-requirements-ledger",
        "kind": "yaml",
        "default_filename": "open-requirements.ledger.yml",
        "description": "Carried obligations ledger re-emitted by this step: entries it appended or closed updated, every other entry passed through with its provenance intact."
      }
    ],
    "consumes": [
      {
        "id": "summary-cwl",
        "description": "Structured CWL summary emitted by [[summarize-cwl]]; the source-of-truth JSON for Galaxy interface choices.",
        "inherited_schema": "[[summary-cwl]]",
        "producers": [
          "summarize-cwl"
        ]
      },
      {
        "id": "open-requirements-ledger",
        "description": "Carried obligations ledger [[open-requirements-ledger]]: the run's open, resolved, and surrendered entries with their provenance. Absent on the first Mold of a run; start an empty one.",
        "producers": [
          "advance-galaxy-draft-step",
          "apply-galaxy-workflow-changeset",
          "compare-against-iwc-exemplar",
          "cwl-summary-to-galaxy-data-flow",
          "cwl-summary-to-galaxy-interface",
          "cwl-summary-to-galaxy-template",
          "freeform-summary-to-galaxy-data-flow",
          "freeform-summary-to-galaxy-interface",
          "freeform-summary-to-galaxy-template",
          "implement-galaxy-tool-step",
          "interview-to-galaxy-workflow-changeset",
          "nextflow-summary-to-galaxy-data-flow",
          "nextflow-summary-to-galaxy-interface",
          "nextflow-summary-to-galaxy-reference-data",
          "nextflow-summary-to-galaxy-template",
          "repair-galaxy-draft-topology"
        ]
      }
    ]
  }
}
