{
  "provenance_schema_version": 4,
  "cast_target": "claude",
  "mold": {
    "name": "nextflow-test-to-cwl-test-plan",
    "path": "content/molds/nextflow-test-to-cwl-test-plan/index.md",
    "revision": 1,
    "content_hash": "6b2b5d921e5998debde2018e44ad2b117e7af6e538feddbff5a17ee21a9e256f",
    "commit": "351623a6d3e96e9bdee421a3ef61df4306489e32"
  },
  "cast_at": "2026-09-08T18:03:25.549Z",
  "refs": [
    {
      "kind": "schema",
      "mode": "verbatim",
      "ref": "[[summary-nextflow]]",
      "src": "package://@galaxy-foundry/summarize-nextflow#summaryNextflowSchema",
      "dst": "references/schemas/summary-nextflow.schema.json",
      "used_at": "runtime",
      "load": "upfront",
      "evidence": "corpus-observed",
      "purpose": "Read summarized nf-test profiles, snapshot fixtures, selected test data, params, and expected outputs.",
      "license": "MIT",
      "src_hash": "2e8cd8294124805e044e7b382e6f8304c36b39533ad5ba8ed03ba681f6ed830a",
      "dst_hash": "2e8cd8294124805e044e7b382e6f8304c36b39533ad5ba8ed03ba681f6ed830a",
      "source": "deterministic"
    }
  ],
  "artifacts": {
    "produces": [
      {
        "id": "cwl-test-plan",
        "kind": "markdown",
        "default_filename": "cwl-test-plan.md",
        "description": "Reviewable CWL workflow test plan: job inputs, expected outputs, assertions, fixtures, rationale provenance."
      }
    ],
    "consumes": [
      {
        "id": "summary-nextflow",
        "description": "Structured Nextflow summary from [[summarize-nextflow]]; carries test_fixtures, nf_tests, snapshot evidence.",
        "inherited_schema": "[[summary-nextflow]]",
        "producers": [
          "summarize-nextflow"
        ]
      }
    ]
  }
}
