{
  "provenance_schema_version": 4,
  "cast_target": "claude",
  "mold": {
    "name": "find-test-data",
    "path": "content/molds/find-test-data/index.md",
    "revision": 4,
    "content_hash": "109bf96b1180534c6c117fc79eb11c7ff562679c862482e3545991672bd6bfa7",
    "commit": "351623a6d3e96e9bdee421a3ef61df4306489e32"
  },
  "cast_at": "2026-09-08T18:03:21.751Z",
  "refs": [
    {
      "kind": "research",
      "mode": "verbatim",
      "ref": "[[galaxy-workflow-testability-design]]",
      "src": "content/research/galaxy-workflow-testability-design/index.md",
      "dst": "references/notes/galaxy-workflow-testability-design.md",
      "used_at": "runtime",
      "load": "on-demand",
      "evidence": "corpus-observed",
      "purpose": "Confirm the collection shapes and labels the resolved data must populate so downstream tests can address them.",
      "trigger": "When mapping an input label in the data-flow brief to a concrete file or collection of files.",
      "src_hash": "81b01801ec3d14810d570dd2d7815da2bb11e41a562af9182c29fd2974f4b855",
      "dst_hash": "81b01801ec3d14810d570dd2d7815da2bb11e41a562af9182c29fd2974f4b855",
      "source": "deterministic"
    },
    {
      "kind": "research",
      "mode": "verbatim",
      "ref": "[[iwc-test-data-conventions]]",
      "src": "content/research/iwc-test-data-conventions/index.md",
      "dst": "references/notes/iwc-test-data-conventions.md",
      "used_at": "runtime",
      "load": "on-demand",
      "evidence": "corpus-observed",
      "purpose": "Match IWC test-data conventions — Zenodo/remote-URL first, SHA-1 integrity, per-input collection layout — when selecting or describing candidate fixtures.",
      "trigger": "When choosing where test data should come from or describing the shape a candidate file must have.",
      "src_hash": "1921e939703444604440e0768caca6e6b834a73dcfa964f450fa081143e008d3",
      "dst_hash": "1921e939703444604440e0768caca6e6b834a73dcfa964f450fa081143e008d3",
      "source": "deterministic"
    }
  ],
  "artifacts": {
    "produces": [
      {
        "id": "test-data-refs",
        "kind": "json",
        "default_filename": "test-data-refs.json",
        "description": "Test data matched from IWC fixtures or public sources, expressed as URLs/paths plus expected shapes for downstream test authoring."
      }
    ],
    "consumes": [
      {
        "id": "freeform-summary",
        "description": "Source summary from [[summarize-paper]] / [[interview-to-freeform-summary]]; mine its sample-data, public-data-candidate, accession, and data-sizing guidance — this is where the source's dataset evidence lives (the design briefs strip it).",
        "producers": [
          "interview-to-freeform-summary",
          "summarize-paper"
        ]
      },
      {
        "id": "summary-nextflow",
        "description": "Source summary from [[summarize-nextflow]]; mine its test_fixtures / sample-data evidence when running the NEXTFLOW → GALAXY pipeline.",
        "inherited_schema": "[[summary-nextflow]]",
        "producers": [
          "summarize-nextflow"
        ]
      },
      {
        "id": "summary-cwl",
        "description": "Source summary from [[summarize-cwl]]; mine its test-data / sample-data evidence when running the CWL → GALAXY pipeline.",
        "inherited_schema": "[[summary-cwl]]",
        "producers": [
          "summarize-cwl"
        ]
      },
      {
        "id": "freeform-galaxy-interface",
        "description": "Galaxy interface brief from [[freeform-summary-to-galaxy-interface]] pinning input labels, collection shapes, and datatypes for the PAPER / INTERVIEW → GALAXY pipelines.",
        "producers": [
          "freeform-summary-to-galaxy-interface"
        ]
      },
      {
        "id": "nextflow-galaxy-interface",
        "description": "Galaxy interface brief from [[nextflow-summary-to-galaxy-interface]] pinning input labels, collection shapes, and datatypes for the NEXTFLOW → GALAXY pipeline.",
        "producers": [
          "nextflow-summary-to-galaxy-interface"
        ]
      },
      {
        "id": "cwl-galaxy-interface",
        "description": "Galaxy interface brief from [[cwl-summary-to-galaxy-interface]] pinning input labels, collection shapes, and datatypes for the CWL → GALAXY pipeline.",
        "producers": [
          "cwl-summary-to-galaxy-interface"
        ]
      }
    ]
  }
}
