{
  "provenance_schema_version": 4,
  "cast_target": "claude",
  "mold": {
    "name": "validate-galaxy-workflow",
    "path": "content/molds/validate-galaxy-workflow/index.md",
    "revision": 4,
    "content_hash": "02f24bacec6166da30493ac9b6a56e5e2ce1fda6b12ec3ad82001ad053512478",
    "commit": "351623a6d3e96e9bdee421a3ef61df4306489e32"
  },
  "cast_at": "2026-09-08T18:03:28.004Z",
  "refs": [
    {
      "kind": "cli-command",
      "mode": "sidecar",
      "ref": "[[gxwf validate]]",
      "src": "content/cli/gxwf/validate.md",
      "dst": "references/cli/validate.json",
      "used_at": "runtime",
      "load": "on-demand",
      "evidence": "hypothesis",
      "purpose": "Validate the assembled gxformat2 workflow before runtime testing.",
      "trigger": "After all Galaxy steps and workflow tests have been assembled.",
      "verification": "Run the cast skill on a complete IWC-derived workflow and confirm terminal validation findings are separated from runtime test failures.",
      "src_hash": "1bf4b4c50e9987f63e65ad36f6deefe6e399fe009280d4bee8533d6c451acf1e",
      "dst_hash": "ff10c49819b0f7af13f247ea03e4dd24ba2e5144da3beaa6b1ab96698c7e03b7",
      "source": "deterministic"
    },
    {
      "kind": "research",
      "mode": "verbatim",
      "ref": "[[galaxy-workflow-invocation-failure-reference]]",
      "src": "content/research/galaxy-workflow-invocation-failure-reference/index.md",
      "dst": "references/notes/galaxy-workflow-invocation-failure-reference.md",
      "used_at": "runtime",
      "load": "on-demand",
      "evidence": "corpus-observed",
      "purpose": "Keep static workflow validation findings distinct from Galaxy invocation/runtime failure surfaces.",
      "trigger": "When a workflow passes gxwf validation but still has likely runtime risks around invocation scheduling, outputs, conditionals, or collection population.",
      "src_hash": "e8115df6ddca447d47d77cb33becda847cdd19b2cbe9924782bfc180b94bb451",
      "dst_hash": "e8115df6ddca447d47d77cb33becda847cdd19b2cbe9924782bfc180b94bb451",
      "source": "deterministic"
    },
    {
      "kind": "research",
      "mode": "verbatim",
      "ref": "[[galaxy-workflow-testability-design]]",
      "src": "content/research/galaxy-workflow-testability-design/index.md",
      "dst": "references/notes/galaxy-workflow-testability-design.md",
      "used_at": "runtime",
      "load": "on-demand",
      "evidence": "corpus-observed",
      "purpose": "Classify validation or pre-test findings that indicate missing labels, omitted workflow outputs, or untestable checkpoint structure.",
      "trigger": "When terminal validation passes but workflow-level outputs, labels, or collection shapes look likely to break future workflow tests.",
      "src_hash": "81b01801ec3d14810d570dd2d7815da2bb11e41a562af9182c29fd2974f4b855",
      "dst_hash": "81b01801ec3d14810d570dd2d7815da2bb11e41a562af9182c29fd2974f4b855",
      "source": "deterministic"
    }
  ]
}
