{
  "provenance_schema_version": 4,
  "cast_target": "claude",
  "mold": {
    "name": "summarize-cwl-tool",
    "path": "content/molds/summarize-cwl-tool/index.md",
    "revision": 2,
    "content_hash": "90e63831882034dbd0d3c735c17b4044943c6eab7dce8d243e606a05e15b0e60",
    "commit": "351623a6d3e96e9bdee421a3ef61df4306489e32"
  },
  "cast_at": "2026-09-08T18:03:26.654Z",
  "refs": [],
  "artifacts": {
    "produces": [
      {
        "id": "cwl-tool-summary",
        "kind": "json",
        "default_filename": "cwl-tool-summary.json",
        "description": "Compact CWL CommandLineTool summary: container, baseCommand, inputs, outputs, requirements, version metadata."
      }
    ],
    "consumes": []
  }
}
