{
  "provenance_schema_version": 4,
  "cast_target": "claude",
  "mold": {
    "name": "author-galaxy-tool-wrapper",
    "path": "content/molds/author-galaxy-tool-wrapper/index.md",
    "revision": 5,
    "content_hash": "cced8f068cd1ce81fefad23a62fdb4d52b3ce805b2231f64a7fe37f258bc1e09",
    "commit": "351623a6d3e96e9bdee421a3ef61df4306489e32"
  },
  "cast_at": "2026-09-08T18:03:18.642Z",
  "cast_date": "2026-05-08",
  "cast_revision": 1,
  "cast_history": [
    {
      "rev": 1,
      "date": "2026-05-08",
      "note": "wire UDT prompt refs"
    }
  ],
  "refs": [
    {
      "kind": "research",
      "mode": "verbatim",
      "ref": "[[component-nextflow-containers-and-envs]]",
      "src": "content/research/component-nextflow-containers-and-envs/index.md",
      "dst": "references/notes/component-nextflow-containers-and-envs.md",
      "used_at": "runtime",
      "load": "on-demand",
      "evidence": "hypothesis",
      "purpose": "Map Nextflow container/conda evidence to Galaxy UDT container and package provenance.",
      "trigger": "When a missing Galaxy user-defined tool must be authored from a Nextflow process with container or conda directives.",
      "verification": "Author one UDT from nf-core/bacass or nf-core/rnaseq process evidence and confirm the note improves requirements/container extraction.",
      "src_hash": "a720bc706423ea601b127fb9e2bcf7e09c439ab59d4ecbb8e3e71b6a827288e1",
      "dst_hash": "a720bc706423ea601b127fb9e2bcf7e09c439ab59d4ecbb8e3e71b6a827288e1",
      "source": "deterministic"
    },
    {
      "kind": "research",
      "mode": "verbatim",
      "ref": "[[component-nextflow-containers-and-envs]]",
      "src": "content/research/component-nextflow-containers-and-envs/component-nextflow-containers-and-envs.yml",
      "dst": "references/notes/component-nextflow-containers-and-envs.yml",
      "used_at": "runtime",
      "load": "on-demand",
      "evidence": "hypothesis",
      "purpose": "Map Nextflow container/conda evidence to Galaxy UDT container and package provenance.",
      "trigger": "When a missing Galaxy user-defined tool must be authored from a Nextflow process with container or conda directives.",
      "companion_of": "references/notes/component-nextflow-containers-and-envs.md",
      "src_hash": "d82f7b3ec3d5b3dfd7de97da1425438a8edcd65dcca169e94ce5baf326a66e8e",
      "dst_hash": "d82f7b3ec3d5b3dfd7de97da1425438a8edcd65dcca169e94ce5baf326a66e8e",
      "source": "deterministic"
    },
    {
      "kind": "research",
      "mode": "verbatim",
      "ref": "[[galaxy-user-tool-authoring]]",
      "src": "content/research/galaxy-user-tool-authoring/index.md",
      "dst": "references/notes/galaxy-user-tool-authoring.md",
      "used_at": "runtime",
      "load": "upfront",
      "evidence": "corpus-observed",
      "purpose": "Field contract, expression syntax, script placement, and package inference for a `GalaxyUserTool` definition.",
      "src_hash": "365fad455369945a34bda537c8dbf409a0966f0f88da9fe78b61cff32d5b0d0d",
      "dst_hash": "365fad455369945a34bda537c8dbf409a0966f0f88da9fe78b61cff32d5b0d0d",
      "source": "deterministic"
    },
    {
      "kind": "research",
      "mode": "verbatim",
      "ref": "[[galaxy-user-tool-critique]]",
      "src": "content/research/galaxy-user-tool-critique/index.md",
      "dst": "references/notes/galaxy-user-tool-critique.md",
      "used_at": "runtime",
      "load": "on-demand",
      "evidence": "corpus-observed",
      "purpose": "Clarity and idiomaticity criteria, and the text-versus-structural test for each proposed fix.",
      "trigger": "After the drafted `GalaxyUserTool` passes structural validation and before emitting `galaxy-user-tool.yml`.",
      "src_hash": "94b047cc268b0f788e8d596b9e809b4764c68b94e8bd4f819c2f9af59d559a11",
      "dst_hash": "94b047cc268b0f788e8d596b9e809b4764c68b94e8bd4f819c2f9af59d559a11",
      "source": "deterministic"
    },
    {
      "kind": "schema",
      "mode": "verbatim",
      "ref": "[[summary-nextflow]]",
      "src": "package://@galaxy-foundry/summarize-nextflow#summaryNextflowSchema",
      "dst": "references/schemas/summary-nextflow.schema.json",
      "used_at": "runtime",
      "load": "upfront",
      "evidence": "corpus-observed",
      "purpose": "Read process tool, container, conda, inputs, outputs, script summary, and test fixture evidence from the source pipeline summary.",
      "license": "MIT",
      "src_hash": "2e8cd8294124805e044e7b382e6f8304c36b39533ad5ba8ed03ba681f6ed830a",
      "dst_hash": "2e8cd8294124805e044e7b382e6f8304c36b39533ad5ba8ed03ba681f6ed830a",
      "source": "deterministic"
    }
  ],
  "artifacts": {
    "produces": [
      {
        "id": "galaxy-user-tool-definition",
        "kind": "yaml",
        "default_filename": "galaxy-user-tool.yml",
        "description": "Galaxy `GalaxyUserTool` YAML definition for a tool not present on the Tool Shed."
      }
    ],
    "consumes": [
      {
        "id": "summary-nextflow",
        "description": "Source pipeline summary from [[summarize-nextflow]]; provides process command, inputs, outputs, and container or conda evidence for UDT authoring.",
        "inherited_schema": "[[summary-nextflow]]",
        "producers": [
          "summarize-nextflow"
        ]
      }
    ]
  }
}
